{"schema_version":"1.0.0","proyecto":{"nombre":"demo-48h","proposito":"Demostración en dos días","usuarios":["dirección"],"propietario":"Diego","criterio_exito":"demo reproducible con fallback"},"ejes":{"forma_codigo":"codigo_propio","patron_ejecucion":"llamada_unica","ritmo":"urgente","madurez":"prototipo","fuente_entrada":"corpus_cerrado","datos_sensibles":false,"herramientas_lectura":false,"herramientas_escritura":false,"reversibilidad":"sin_acciones","coste_prueba":{"economico":0,"minutos":2,"revision_humana":true},"capacidad_decision":"plena","horizonte_vida":"dias"},"observacion":{"hechos":[],"inferencias":[],"desconocidos":[],"preguntas_pendientes":[]}}
