{"schema_version":"1.0.0","proyecto":{"nombre":"manual-asistido","proposito":"Producir informes","usuarios":["analista"],"propietario":"Carla","criterio_exito":"informe revisable"},"ejes":{"forma_codigo":"sin_codigo_propio","patron_ejecucion":"workflow","ritmo":"evolutivo","madurez":"uso_interno","fuente_entrada":"corpus_cerrado","datos_sensibles":false,"herramientas_lectura":true,"herramientas_escritura":false,"reversibilidad":"sin_acciones","coste_prueba":{"economico":0,"minutos":10,"revision_humana":true},"capacidad_decision":"plena","horizonte_vida":"anos"},"observacion":{"hechos":[],"inferencias":[],"desconocidos":[],"preguntas_pendientes":[]}}
