{"schema_version":"1.0.0","proyecto":{"nombre":"agente-escritor","proposito":"Operar tickets externos","usuarios":["operaciones"],"propietario":"Berta","criterio_exito":"resolver sin acciones indebidas"},"ejes":{"forma_codigo":"hibrido","patron_ejecucion":"agente","ritmo":"evolutivo","madurez":"produccion","fuente_entrada":"entrada_externa","datos_sensibles":true,"herramientas_lectura":true,"herramientas_escritura":true,"reversibilidad":"mixta","coste_prueba":{"economico":3,"minutos":20,"revision_humana":true},"capacidad_decision":"compartida","horizonte_vida":"indefinido"},"observacion":{"hechos":[],"inferencias":[],"desconocidos":[],"preguntas_pendientes":[]}}
