{"schema_version":"1.0.0","proyecto":{"nombre":"app-corpus","proposito":"Responder sobre un corpus cerrado","usuarios":["equipo"],"propietario":"Ana","criterio_exito":"respuestas trazables"},"ejes":{"forma_codigo":"codigo_propio","patron_ejecucion":"llamada_unica","ritmo":"evolutivo","madurez":"prototipo","fuente_entrada":"corpus_cerrado","datos_sensibles":false,"herramientas_lectura":false,"herramientas_escritura":false,"reversibilidad":"sin_acciones","coste_prueba":{"economico":0,"minutos":1,"revision_humana":false},"capacidad_decision":"plena","horizonte_vida":"meses"},"observacion":{"hechos":[],"inferencias":[],"desconocidos":[],"preguntas_pendientes":[]}}
